{
  "$schema": "fixture.schema.json",
  "description": "采购合同测试夹具",
  "generatedAt": "2026-07-10",
  "data": {
    "id": "660e8400-e29b-41d4-a716-446655440020",
    "code": "CTT-2026-0020",
    "name": "电子元器件采购合同-上海精密机械有限公司",
    "type": "purchase_contract",
    "supplierId": "550e8400-e29b-41d4-a716-446655440002",
    "handlerId": "770e8400-e29b-41d4-a716-446655440001",
    "handlerName": "经办人A",
    "templateId": "880e8400-e29b-41d4-a716-446655440002",
    "content": {
      "contractName": "电子元器件采购合同",
      "supplierName": "上海精密机械有限公司",
      "paymentTerms": "货到30天付款",
      "deliveryLocation": "深圳仓库"
    },
    "totalAmount": 125580.5,
    "effectiveDate": "2026-07-10",
    "expirationDate": "2027-07-09",
    "status": "effective",
    "companyName": "本公司",
    "createdAt": "2026-07-05T08:00:00.000Z",
    "updatedAt": "2026-07-10T00:00:00.000Z"
  },
  "entries": [
    {
      "id": "660e8400-e29b-41d4-a716-446655440021",
      "contractId": "660e8400-e29b-41d4-a716-446655440020",
      "materialId": "aa0e8400-e29b-41d4-a716-446655440030",
      "materialName": "精密轴承 6205",
      "spec": "内径25mm",
      "unitPrice": 85.5,
      "quantity": 500,
      "unit": "个",
      "totalPrice": 42750.0,
      "remark": "",
      "sortOrder": 1
    },
    {
      "id": "660e8400-e29b-41d4-a716-446655440022",
      "contractId": "660e8400-e29b-41d4-a716-446655440020",
      "materialId": "aa0e8400-e29b-41d4-a716-446655440031",
      "materialName": "铝合金外壳 AN-100",
      "spec": "100x100x50mm",
      "unitPrice": 120.0,
      "quantity": 300,
      "unit": "个",
      "totalPrice": 36000.0,
      "remark": "表面阳极氧化处理",
      "sortOrder": 2
    },
    {
      "id": "660e8400-e29b-41d4-a716-446655440023",
      "contractId": "660e8400-e29b-41d4-a716-446655440020",
      "materialId": "aa0e8400-e29b-41d4-a716-446655440032",
      "materialName": "不锈钢螺丝 M6x20",
      "spec": "304不锈钢",
      "unitPrice": 0.85,
      "quantity": 55000,
      "unit": "个",
      "totalPrice": 46750.0,
      "remark": "含垫片",
      "sortOrder": 3
    }
  ]
}
